{
  "task_id": "octogent-child-agent-smoke",
  "status": "success",
  "executor": "octogent",
  "started_at": "2026-05-30T08:40:37.460Z",
  "completed_at": "2026-05-30T08:40:37.463Z",
  "summary": "Octogent docs gate verified.",
  "evidence": [
    {
      "id": "octogent-child-agent-smoke.cwd",
      "task_id": "octogent-child-agent-smoke",
      "type": "file_exists",
      "source": "C:\\Projects\\octogent",
      "observed_at": "2026-05-30T08:40:37.462Z",
      "summary": "Task cwd exists",
      "data": {},
      "verifier": "atlas-operator-dispatcher"
    },
    {
      "id": "octogent-child-agent-smoke.0",
      "task_id": "octogent-child-agent-smoke",
      "type": "file_read",
      "source": "C:\\Projects\\octogent\\docs\\guides\\orchestrating-child-agents.md",
      "observed_at": "2026-05-30T08:40:37.462Z",
      "summary": "# Orchestrating Child Agents",
      "data": {},
      "verifier": "atlas-operator-dispatcher"
    },
    {
      "id": "octogent-child-agent-smoke.1",
      "task_id": "octogent-child-agent-smoke",
      "type": "file_read",
      "source": "C:\\Projects\\octogent\\docs\\concepts\\tentacles.md",
      "observed_at": "2026-05-30T08:40:37.462Z",
      "summary": "# Tentacles",
      "data": {},
      "verifier": "atlas-operator-dispatcher"
    },
    {
      "id": "octogent-child-agent-smoke.2",
      "task_id": "octogent-child-agent-smoke",
      "type": "file_read",
      "source": "C:\\Projects\\octogent\\docs\\reference\\cli.md",
      "observed_at": "2026-05-30T08:40:37.462Z",
      "summary": "# CLI Reference",
      "data": {},
      "verifier": "atlas-operator-dispatcher"
    },
    {
      "id": "octogent-child-agent-smoke.trace",
      "task_id": "octogent-child-agent-smoke",
      "type": "log_trace",
      "source": "C:\\Projects\\octogent",
      "observed_at": "2026-05-30T08:40:37.463Z",
      "summary": "C:\\Projects\\octogent\\docs\\guides\\orchestrating-child-agents.md: # Orchestrating Child Agents; C:\\Projects\\octogent\\docs\\concepts\\tentacles.md: # Tentacles; C:\\Projects\\octogent\\docs\\reference\\cli.md: # CLI Reference; matched terms: parentTerminalId, todo.md, shared, worktree",
      "data": {},
      "verifier": "atlas-operator-dispatcher"
    }
  ],
  "errors": [],
  "trace_path": "C:\\Users\\user\\OneDrive\\Documents\\GitHub\\ANUS\\operator\\runs\\octogent-child-agent-smoke.result.json"
}
