{
  "task_id": "octogent-parent-swarm-loop-smoke",
  "status": "success",
  "executor": "octogent",
  "started_at": "2026-05-30T08:20:11.818Z",
  "completed_at": "2026-05-30T08:20:11.824Z",
  "summary": "Octogent docs gate verified.",
  "evidence": [
    {
      "id": "octogent-parent-swarm-loop-smoke.cwd",
      "task_id": "octogent-parent-swarm-loop-smoke",
      "type": "file_exists",
      "source": "C:\\Projects\\octogent",
      "observed_at": "2026-05-30T08:20:11.820Z",
      "summary": "Task cwd exists",
      "data": {},
      "verifier": "atlas-operator-dispatcher"
    },
    {
      "id": "octogent-parent-swarm-loop-smoke.0",
      "task_id": "octogent-parent-swarm-loop-smoke",
      "type": "file_read",
      "source": "C:\\Projects\\octogent\\prompts\\swarm-parent.md",
      "observed_at": "2026-05-30T08:20:11.821Z",
      "summary": "You are the swarm coordinator for the **{{tentacleName}}** tentacle. Your job is NOT to do the work — it's to create, supervise, and merge {{workerCount}} worke",
      "data": {},
      "verifier": "atlas-operator-dispatcher"
    },
    {
      "id": "octogent-parent-swarm-loop-smoke.1",
      "task_id": "octogent-parent-swarm-loop-smoke",
      "type": "file_read",
      "source": "C:\\Projects\\octogent\\prompts\\swarm-worker.md",
      "observed_at": "2026-05-30T08:20:11.821Z",
      "summary": "You are a swarm worker agent for the **{{tentacleName}}** tentacle. Your single job is to complete one todo item, leave a clean result in your assigned workspac",
      "data": {},
      "verifier": "atlas-operator-dispatcher"
    },
    {
      "id": "octogent-parent-swarm-loop-smoke.2",
      "task_id": "octogent-parent-swarm-loop-smoke",
      "type": "file_read",
      "source": "C:\\Projects\\octogent\\docs\\guides\\working-with-todos.md",
      "observed_at": "2026-05-30T08:20:11.822Z",
      "summary": "# Working With Todos",
      "data": {},
      "verifier": "atlas-operator-dispatcher"
    },
    {
      "id": "octogent-parent-swarm-loop-smoke.3",
      "task_id": "octogent-parent-swarm-loop-smoke",
      "type": "file_read",
      "source": "C:\\Projects\\octogent\\docs\\guides\\orchestrating-child-agents.md",
      "observed_at": "2026-05-30T08:20:11.823Z",
      "summary": "# Orchestrating Child Agents",
      "data": {},
      "verifier": "atlas-operator-dispatcher"
    },
    {
      "id": "octogent-parent-swarm-loop-smoke.trace",
      "task_id": "octogent-parent-swarm-loop-smoke",
      "type": "log_trace",
      "source": "C:\\Projects\\octogent",
      "observed_at": "2026-05-30T08:20:11.824Z",
      "summary": "C:\\Projects\\octogent\\prompts\\swarm-parent.md: You are the swarm coordinator for the **{{tentacleName}}** tentacle. Your job is NOT to do the work — it's to create, supervise, and merge {{workerCount}} worke; C:\\Projects\\octogent\\prompts\\swarm-worker.md: You are a swarm worker agent for the **{{tentacleName}}** tentacle. Your single job is to complete one todo item, leave a clean result in your assigned workspac; C:\\Projects\\octogent\\docs\\guides\\working-with-todos.md: # Working With Todos; C:\\Projects\\octogent\\docs\\guides\\orchestrating-child-agents.md: # Orchestrating Child Agents; matched terms: spawn workers, BLOCKED, DONE, todo item, parent coordinator",
      "data": {},
      "verifier": "atlas-operator-dispatcher"
    }
  ],
  "errors": [],
  "trace_path": "C:\\Users\\user\\OneDrive\\Documents\\GitHub\\ANUS\\operator\\runs\\octogent-parent-swarm-loop-smoke.result.json"
}
