{
  "task_id": "octogent-scaffold-smoke",
  "status": "success",
  "executor": "octogent",
  "started_at": "2026-05-29T19:20:36.470Z",
  "completed_at": "2026-05-29T19:20:36.471Z",
  "summary": "Octogent scaffold verified.",
  "evidence": [
    {
      "id": "octogent-scaffold-smoke.cwd",
      "task_id": "octogent-scaffold-smoke",
      "type": "file_exists",
      "source": "C:\\Projects\\octogent",
      "observed_at": "2026-05-29T19:20:36.471Z",
      "summary": "Task cwd exists",
      "data": {},
      "verifier": "atlas-operator-dispatcher"
    },
    {
      "id": "octogent-scaffold-smoke.package",
      "task_id": "octogent-scaffold-smoke",
      "type": "file_read",
      "source": "C:\\Projects\\octogent\\package.json",
      "observed_at": "2026-05-29T19:20:36.471Z",
      "summary": "package name octogent; scripts start, dev, build, smoke:public-install, test, lint, format",
      "data": {},
      "verifier": "atlas-operator-dispatcher"
    },
    {
      "id": "octogent-scaffold-smoke.readme",
      "task_id": "octogent-scaffold-smoke",
      "type": "file_read",
      "source": "C:\\Projects\\octogent\\README.md",
      "observed_at": "2026-05-29T19:20:36.471Z",
      "summary": "README mentions tentacles",
      "data": {},
      "verifier": "atlas-operator-dispatcher"
    },
    {
      "id": "octogent-scaffold-smoke.trace",
      "task_id": "octogent-scaffold-smoke",
      "type": "log_trace",
      "source": "C:\\Projects\\octogent",
      "observed_at": "2026-05-29T19:20:36.471Z",
      "summary": "Octogent repo present; README present",
      "data": {},
      "verifier": "atlas-operator-dispatcher"
    }
  ],
  "errors": [],
  "trace_path": "C:\\Users\\user\\OneDrive\\Documents\\GitHub\\ANUS\\operator\\runs\\octogent-scaffold-smoke.result.json"
}
