{
  "task_id": "octogent-inter-agent-message-smoke",
  "status": "success",
  "executor": "octogent",
  "started_at": "2026-05-30T08:41:18.794Z",
  "completed_at": "2026-05-30T08:41:18.797Z",
  "summary": "Octogent docs gate verified.",
  "evidence": [
    {
      "id": "octogent-inter-agent-message-smoke.cwd",
      "task_id": "octogent-inter-agent-message-smoke",
      "type": "file_exists",
      "source": "C:\\Projects\\octogent",
      "observed_at": "2026-05-30T08:41:18.795Z",
      "summary": "Task cwd exists",
      "data": {},
      "verifier": "atlas-operator-dispatcher"
    },
    {
      "id": "octogent-inter-agent-message-smoke.0",
      "task_id": "octogent-inter-agent-message-smoke",
      "type": "file_read",
      "source": "C:\\Projects\\octogent\\docs\\guides\\inter-agent-messaging.md",
      "observed_at": "2026-05-30T08:41:18.796Z",
      "summary": "# Inter-Agent Messaging",
      "data": {},
      "verifier": "atlas-operator-dispatcher"
    },
    {
      "id": "octogent-inter-agent-message-smoke.1",
      "task_id": "octogent-inter-agent-message-smoke",
      "type": "file_read",
      "source": "C:\\Projects\\octogent\\docs\\reference\\cli.md",
      "observed_at": "2026-05-30T08:41:18.796Z",
      "summary": "# CLI Reference",
      "data": {},
      "verifier": "atlas-operator-dispatcher"
    },
    {
      "id": "octogent-inter-agent-message-smoke.trace",
      "task_id": "octogent-inter-agent-message-smoke",
      "type": "log_trace",
      "source": "C:\\Projects\\octogent",
      "observed_at": "2026-05-30T08:41:18.797Z",
      "summary": "C:\\Projects\\octogent\\docs\\guides\\inter-agent-messaging.md: # Inter-Agent Messaging; C:\\Projects\\octogent\\docs\\reference\\cli.md: # CLI Reference; matched terms: channel send, terminal-id, undelivered, in-memory",
      "data": {},
      "verifier": "atlas-operator-dispatcher"
    }
  ],
  "errors": [],
  "trace_path": "C:\\Users\\user\\OneDrive\\Documents\\GitHub\\ANUS\\operator\\runs\\octogent-inter-agent-message-smoke.result.json"
}
